{
  "schema": "layout_fit_block_samples",
  "schema_version": "1.0",
  "source_job_id": "20260407033349-ffe2e4",
  "source_job_root": "/home/wxyhgk/tmp/Code/data/jobs/20260407033349-ffe2e4",
  "source_pdf_page_count": 13,
  "samples": [
    {
      "sample_id": "20260407033349-ffe2e4:p001-b0002",
      "job_id": "20260407033349-ffe2e4",
      "block_id": "p001-b0002",
      "page_index": 0,
      "block_index": 2,
      "type": "text",
      "sub_type": "title",
      "page": {
        "width": 612.0,
        "height": 792.0,
        "unit": "pt"
      },
      "target_box": {
        "x": 67,
        "y": 465,
        "width": 408,
        "height": 118,
        "unit": "pt"
      },
      "source_text": "Industrial Policy for the Intelligence Age: Ideas to Keep People First",
      "translated_text": "",
      "translation_unit_text": "",
      "fit_text": "Industrial Policy for the Intelligence Age: Ideas to Keep People First",
      "text_source": "source_ocr",
      "source_pdf_href": "../fixtures/source-pdfs/20260407033349-ffe2e4.pdf",
      "source_pdf_page_href": "../fixtures/pdf-pages/20260407033349-ffe2e4/page-001.png",
      "source_line_count": 3
    },
    {
      "sample_id": "20260407033349-ffe2e4:p001-b0003",
      "job_id": "20260407033349-ffe2e4",
      "block_id": "p001-b0003",
      "page_index": 0,
      "block_index": 3,
      "type": "text",
      "sub_type": "body",
      "page": {
        "width": 612.0,
        "height": 792.0,
        "unit": "pt"
      },
      "target_box": {
        "x": 68,
        "y": 644,
        "width": 67,
        "height": 18,
        "unit": "pt"
      },
      "source_text": "April 2026",
      "translated_text": "2026年4月",
      "translation_unit_text": "2026年4月",
      "fit_text": "2026年4月",
      "text_source": "translated_json",
      "source_pdf_href": "../fixtures/source-pdfs/20260407033349-ffe2e4.pdf",
      "source_pdf_page_href": "../fixtures/pdf-pages/20260407033349-ffe2e4/page-001.png",
      "source_line_count": 1
    },
    {
      "sample_id": "20260407033349-ffe2e4:p002-b0000",
      "job_id": "20260407033349-ffe2e4",
      "block_id": "p002-b0000",
      "page_index": 1,
      "block_index": 0,
      "type": "text",
      "sub_type": "title",
      "page": {
        "width": 612.0,
        "height": 792.0,
        "unit": "pt"
      },
      "target_box": {
        "x": 71,
        "y": 86,
        "width": 160,
        "height": 34,
        "unit": "pt"
      },
      "source_text": "Let’s Talk",
      "translated_text": "",
      "translation_unit_text": "",
      "fit_text": "Let’s Talk",
      "text_source": "source_ocr",
      "source_pdf_href": "../fixtures/source-pdfs/20260407033349-ffe2e4.pdf",
      "source_pdf_page_href": "../fixtures/pdf-pages/20260407033349-ffe2e4/page-002.png",
      "source_line_count": 1
    },
    {
      "sample_id": "20260407033349-ffe2e4:p002-b0001",
      "job_id": "20260407033349-ffe2e4",
      "block_id": "p002-b0001",
      "page_index": 1,
      "block_index": 1,
      "type": "text",
      "sub_type": "body",
      "page": {
        "width": 612.0,
        "height": 792.0,
        "unit": "pt"
      },
      "target_box": {
        "x": 70,
        "y": 212,
        "width": 471,
        "height": 119,
        "unit": "pt"
      },
      "source_text": "The drive to understand has always powered human progress—creating a fl ywheel from science to technology, from technology to discovery, and from discovery onward to more science. That inexorable forward movement led us to melt sand, add impurities, structure it with atomic precision into computer chips, run energy through those chips, and build systems capable of creating increasingly powerful artifi cial intelligence.",
      "translated_text": "理解世界的驱动力始终推动着人类进步——它创造了一个从科学到技术、从技术到发现、再从发现到更多科学的飞轮。这种不可阻挡的前进运动引领我们熔炼沙子、添加杂质、以原子精度将其结构化为计算机芯片、让能量流经这些芯片，并构建出能够创造日益强大的人工智能的系统。",
      "translation_unit_text": "理解世界的驱动力始终推动着人类进步——它创造了一个从科学到技术、从技术到发现、再从发现到更多科学的飞轮。这种不可阻挡的前进运动引领我们熔炼沙子、添加杂质、以原子精度将其结构化为计算机芯片、让能量流经这些芯片，并构建出能够创造日益强大的人工智能的系统。",
      "fit_text": "理解世界的驱动力始终推动着人类进步——它创造了一个从科学到技术、从技术到发现、再从发现到更多科学的飞轮。这种不可阻挡的前进运动引领我们熔炼沙子、添加杂质、以原子精度将其结构化为计算机芯片、让能量流经这些芯片，并构建出能够创造日益强大的人工智能的系统。",
      "text_source": "translated_json",
      "source_pdf_href": "../fixtures/source-pdfs/20260407033349-ffe2e4.pdf",
      "source_pdf_page_href": "../fixtures/pdf-pages/20260407033349-ffe2e4/page-002.png",
      "source_line_count": 6,
      "typst": {
        "body_name": "p1_item_1_0_body",
        "body_expr": "block(width: 447.45000000000005pt)[#{ set text(size: 11.24pt); set par(leading: 0.7em); cmarker.render(p1_item_1_0_md, math: mitex) }]",
        "markdown_text": "理解世界的驱动力始终推动着人类进步——它创造了一个从科学到技术、从技术到发现、再从发现到更多科学的飞轮。这种不可阻挡的前进运动引领我们熔炼沙子、添加杂质、以原子精度将其结构化为计算机芯片、让能量流经这些芯片，并构建出能够创造日益强大的人工智能的系统。",
        "width_pt": 447.45000000000005,
        "text_size_pt": 11.24,
        "leading_em": 0.7
      }
    },
    {
      "sample_id": "20260407033349-ffe2e4:p002-b0002",
      "job_id": "20260407033349-ffe2e4",
      "block_id": "p002-b0002",
      "page_index": 1,
      "block_index": 2,
      "type": "text",
      "sub_type": "body",
      "page": {
        "width": 612.0,
        "height": 792.0,
        "unit": "pt"
      },
      "target_box": {
        "x": 70,
        "y": 372,
        "width": 471,
        "height": 105,
        "unit": "pt"
      },
      "source_text": "In just a few years, AI has progressed from systems capable of fast, narrow tasks to models that can perform general tasks people used to need hours to do. Now, we’re beginning a transition toward superintelligence: AI systems capable of outperforming the smartest humans even when they are assisted by AI. No one knows exactly how this transition will unfold. At OpenAI, we believe we should navigate it through a democratic process that gives people real power to shape the AI future they want, and prepare for a range of possible outcomes while building the capacity to adapt. That’s what this document is for—to start a conversation about governing advanced AI in ways that keep people fi rst.",
      "translated_text": "短短几年内，人工智能已从仅能执行快速、特定任务的系统，发展为能够完成以往人们需要数小时才能处理的通用任务模型。如今，我们正开始向超级智能过渡：即能够超越最聪明人类（即使他们得到人工智能辅助）的人工智能系统。无人确切知晓这一过渡将如何展开。在OpenAI，我们认为应通过民主进程来引导这一过程，赋予人们真正的权力以塑造他们期望的人工智能未来，并在构建适应能力的同时，为一系列可能的结果做好准备。本文档的目的正在于此——开启一场关于以人为本地治理先进人工智能的讨论。",
      "translation_unit_text": "短短几年内，人工智能已从仅能执行快速、特定任务的系统，发展为能够完成以往人们需要数小时才能处理的通用任务模型。如今，我们正开始向超级智能过渡：即能够超越最聪明人类（即使他们得到人工智能辅助）的人工智能系统。无人确切知晓这一过渡将如何展开。在OpenAI，我们认为应通过民主进程来引导这一过程，赋予人们真正的权力以塑造他们期望的人工智能未来，并在构建适应能力的同时，为一系列可能的结果做好准备。本文档的目的正在于此——开启一场关于以人为本地治理先进人工智能的讨论。",
      "fit_text": "短短几年内，人工智能已从仅能执行快速、特定任务的系统，发展为能够完成以往人们需要数小时才能处理的通用任务模型。如今，我们正开始向超级智能过渡：即能够超越最聪明人类（即使他们得到人工智能辅助）的人工智能系统。无人确切知晓这一过渡将如何展开。在OpenAI，我们认为应通过民主进程来引导这一过程，赋予人们真正的权力以塑造他们期望的人工智能未来，并在构建适应能力的同时，为一系列可能的结果做好准备。本文档的目的正在于此——开启一场关于以人为本地治理先进人工智能的讨论。",
      "text_source": "translated_json",
      "source_pdf_href": "../fixtures/source-pdfs/20260407033349-ffe2e4.pdf",
      "source_pdf_page_href": "../fixtures/pdf-pages/20260407033349-ffe2e4/page-002.png",
      "source_line_count": 7,
      "typst": {
        "body_name": "p1_item_2_1_body",
        "body_expr": "block(width: 447.45000000000005pt, height: 98.70000000000005pt)[#{ pdftr_fit_markdown(p1_item_2_1_md, max_size: 11.06pt, min_size: 10.91pt, max_leading: 0.6em, min_leading: 0.56em, fit_height: 98.7pt) }]",
        "markdown_text": "短短几年内，人工智能已从仅能执行快速、特定任务的系统，发展为能够完成以往人们需要数小时才能处理的通用任务模型。如今，我们正开始向超级智能过渡：即能够超越最聪明人类（即使他们得到人工智能辅助）的人工智能系统。无人确切知晓这一过渡将如何展开。在OpenAI，我们认为应通过民主进程来引导这一过程，赋予人们真正的权力以塑造他们期望的人工智能未来，并在构建适应能力的同时，为一系列可能的结果做好准备。本文档的目的正在于此——开启一场关于以人为本地治理先进人工智能的讨论。",
        "width_pt": 447.45000000000005,
        "height_pt": 98.70000000000005,
        "fit_height_pt": 98.7,
        "max_size_pt": 11.06,
        "min_size_pt": 10.91,
        "max_leading_em": 0.6,
        "min_leading_em": 0.56
      }
    },
    {
      "sample_id": "20260407033349-ffe2e4:p002-b0003",
      "job_id": "20260407033349-ffe2e4",
      "block_id": "p002-b0003",
      "page_index": 1,
      "block_index": 3,
      "type": "text",
      "sub_type": "body",
      "page": {
        "width": 612.0,
        "height": 792.0,
        "unit": "pt"
      },
      "target_box": {
        "x": 70,
        "y": 491,
        "width": 471,
        "height": 74,
        "unit": "pt"
      },
      "source_text": "The promise of superintelligence is extraordinary. Just as electricity transformed homes, the combustion engine remade mobility, and mass production lowered the cost of essential goods, superintelligence will speed up scientifi c and medical breakthroughs, signifi cantly increase productivity, lower costs for families by making essential goods cheaper, and open the way for entirely new forms of work, creativity, and entrepreneurship.",
      "translated_text": "超级智能的前景是巨大的。正如电力改变了家庭生活、内燃机重塑了交通方式、大规模生产降低了必需品的成本一样，超级智能将加速科学和医学突破，显著提高生产力，通过降低必需品的价格来减少家庭开支，并为全新的工作形式、创造力和创业开辟道路。",
      "translation_unit_text": "超级智能的前景是巨大的。正如电力改变了家庭生活、内燃机重塑了交通方式、大规模生产降低了必需品的成本一样，超级智能将加速科学和医学突破，显著提高生产力，通过降低必需品的价格来减少家庭开支，并为全新的工作形式、创造力和创业开辟道路。",
      "fit_text": "超级智能的前景是巨大的。正如电力改变了家庭生活、内燃机重塑了交通方式、大规模生产降低了必需品的成本一样，超级智能将加速科学和医学突破，显著提高生产力，通过降低必需品的价格来减少家庭开支，并为全新的工作形式、创造力和创业开辟道路。",
      "text_source": "translated_json",
      "source_pdf_href": "../fixtures/source-pdfs/20260407033349-ffe2e4.pdf",
      "source_pdf_page_href": "../fixtures/pdf-pages/20260407033349-ffe2e4/page-002.png",
      "source_line_count": 5,
      "typst": {
        "body_name": "p1_item_3_2_body",
        "body_expr": "block(width: 447.45000000000005pt)[#{ set text(size: 11.16pt); set par(leading: 0.6em); cmarker.render(p1_item_3_2_md, math: mitex) }]",
        "markdown_text": "超级智能的前景是巨大的。正如电力改变了家庭生活、内燃机重塑了交通方式、大规模生产降低了必需品的成本一样，超级智能将加速科学和医学突破，显著提高生产力，通过降低必需品的价格来减少家庭开支，并为全新的工作形式、创造力和创业开辟道路。",
        "width_pt": 447.45000000000005,
        "text_size_pt": 11.16,
        "leading_em": 0.6
      }
    },
    {